[11/01/2021, 20:24:18] ××ª×›×•× ×™× ××•×©×œ××™×: â€Messages and calls are end-to-end encrypted. Only people in this chat can read, listen to, or share them.
[11/01/2021, 20:24:18] ××ª×›×•× ×™× ××•×©×œ××™×: â€You created this group
[11/01/2021, 20:24:24] ××œ×™××‘×™: â€You removed ××œ×™××‘×™
[11/01/2021, 20:24:32] Tal: https://www.instagram.com/p/CJ6J7bdnJ0Y/?igshid=1nlrcvpu25twl
[11/01/2021, 20:25:08] Tal: https://www.instagram.com/p/CJ3z4DzFKF4/?igshid=mw1uv057t643
[11/01/2021, 20:28:29] Tal: â€You deleted this message.
[11/01/2021, 20:28:35] Tal: https://www.oogio.net/cinnamon_butter_cookies/
[11/01/2021, 20:29:30] Tal: https://www.instagram.com/p/CJtRlL8H1Ub/?igshid=v064ortqlat8
[11/01/2021, 20:30:19] Tal: https://www.instagram.com/p/CJloHZmHHHG/?igshid=1dkyygl1197e6
[14/01/2021, 17:47:58] Tal: https://www.oogio.net/pecan_craquelin_cream_puffs/
[14/01/2021, 18:52:09] Tal: https://www.heninthekitchen.com/×¤×¨×§-78-×œ×‘×™×‘×•×ª-×‘×˜×˜×”-×¢×-×’×‘×™× ×ª-×¢×–×™×/
[21/01/2021, 23:14:58] Tal: https://www.instagram.com/p/CKQf-gHDE8J/?igshid=1bf8rbifeujpe
[29/01/2021, 15:18:14] Tal: https://www.instagram.com/p/CKmMMYZjwES/?igshid=2lpiefbu12v9
[02/02/2021, 22:55:20] Tal: https://www.instagram.com/p/CKjimyUgO6k/?igshid=s25cczhbmhnf
[03/02/2021, 18:31:43] Tal: https://www.facebook.com/groups/hungryinyourhunger/permalink/1888645041313336/
[09/02/2021, 22:20:23] Tal: https://www.lichtenstadt.com/2021/01/×¨×™×‘×•×¢×™-×¢×•×’×ª-×’×‘×™× ×”-×¢×-×¤×™×¨×•×ª-×™×¢×¨-×•×§×¨×××‘×œ/
[22/02/2021, 12:11:17] Tal: https://www.facebook.com/groups/hungryinyourhunger/permalink/1902301919947648/
[22/02/2021, 12:11:24] Tal: ×¢×•×’×™×•×ª ×©×•×§×•×œ×“ ×¦'×™×¤×¡ ××•×©×œ××•×ª
[22/02/2021, 12:51:16] Tal: https://www.lichtenstadt.com/2021/01/%D7%97%D7%9C%D7%AA-%D7%A9%D7%A7%D7%93%D7%99%D7%9D-%D7%97%D7%9C%D7%94-%D7%9E%D7%AA%D7%95%D7%A7%D7%94-%D7%9E%D7%9E%D7%95%D7%9C%D7%90%D7%AA-%D7%A7%D7%A8%D7%9D-%D7%A9%D7%A7%D7%93%D7%99%D7%9D/
[22/02/2021, 16:58:38] Tal: https://www.instagram.com/p/CLmBEDEFKYP/?igshid=1tpb3tkgii7ml
[01/03/2021, 19:30:04] Tal: ××§×œ×•×ª ×¤×¨××–×Ÿ ×¤×¨×™×›×™× ×©×œ ×§×¨×™×Ÿ ×’×•×¨×Ÿ https://www.carine.co.il/?p=19170
[03/03/2021, 20:39:54] Tal: https://www.facebook.com/watch/?v=192031452252987
[04/03/2021, 11:14:41] Tal: https://www.oogio.net/raspberry_apple_vanilla_pecan_pie/
[04/03/2021, 11:56:13] Tal: https://www.facebook.com/watch/?v=1648305395371186
â€[13/03/2021, 18:59:16] Tal: â€<attached: 00000025-PHOTO-2021-03-13-18-59-16.jpg>
[02/04/2021, 0:56:02] Tal: https://www.instagram.com/p/CNHMV5hjE1V/?igshid=9wnon9qx6r0b
[24/04/2021, 21:29:37] Tal: https://bakery365.co.il/2019/02/18/%d7%98%d7%90%d7%a8%d7%98-%d7%90%d7%95-%d7%a1%d7%95%d7%9b%d7%a8%d7%94/
[26/04/2021, 15:39:30] Tal: https://youtu.be/t9HZ_l2jh0E
[12/05/2021, 19:13:32] Tal: https://www.instagram.com/reel/COxr9HigA8i/?igshid=129w284kypw1o
[12/05/2021, 20:45:00] Tal: ×¢×•×’×ª ×’×‘×™× ×” ×¤×™×¨×•×¨×™×
×××¤×™× ×¡ ×¤×™×¨×•×ª ×™×¢×¨ ×•×©×•×§×•×œ×“ ×œ×‘×Ÿ
×§×™×© ×¤×˜×¨×™×•×ª ×•×‘×¦×œ
[26/05/2021, 19:22:56] Tal: https://www.carine.co.il/foody_recipe/%D7%9E%D7%90%D7%A4%D7%99%D7%A0%D7%A1-%D7%A9%D7%95%D7%A7%D7%95%D7%9C%D7%93-%D7%9C%D7%91%D7%9F-%D7%A2%D7%9D-%D7%A9%D7%A7%D7%93%D7%99%D7%9D-%D7%95%D7%A4%D7%99%D7%A8%D7%95%D7%AA-%D7%99%D7%A2%D7%A8/
[26/05/2021, 19:23:21] Tal: https://www.oogio.net/apple_crumble_muffins/
â€[28/05/2021, 15:49:33] Tal: â€<attached: 00000033-PHOTO-2021-05-28-15-49-33.jpg>
[31/05/2021, 19:17:46] Tal: ×–×•×¨×§×ª ×œ×š ×©×™×”×™×” ×œ×š ×›×™ ×œ×¤×¢××™× ××ª ×©×•××œ×ª ××•×ª×™ ×¢×œ ×’×™×•×•× ×™× ×‘××¨×•×—×•×ª, ×¤×©×•×˜ ×›×™ ×”×›× ×• ×¢×›×©×™×•..
×œ×‘×™×‘×•×ª ×©×œ ×ª×™×¨×¡ ×•×’×‘×™× ×•×ª - ×‘×’×“×•×œ ×©××™× ×ª×™×¨×¡ ××§×•×¤×¡×ª ×©×™××•×¨×™×, ×—×‘×™×œ×ª ×’×‘×™× ×”/×§×•×˜×’', 2 ×‘×™×¦×™×, ×—×¦×™ ×›×•×¡ ×§××—, ×§×¦×ª ×’×‘×™× ×” ×¦×”×•×‘×” ×•××œ×— ×¤×œ×¤×œ. ×× ×—× ×• ××˜×’× ×™× ×‘×§×¦×ª ×©××Ÿ ×–×™×ª. ×™×•×¦× ğŸ‘ŒğŸ»
×”×××ª ×™×¦× ×œ× ×• ×œ×”×›×™×Ÿ ×›×‘×¨ ×›××” ×¤×¢××™× ×•×–×” ×××© ×’×™×•×•×Ÿ × ×—××“ ×•××¨×•×—×ª ×¢×¨×‘ ×©×•× ×” ×•×§×œ×™×œ×” ×™×—×¡×™×ª.
[01/06/2021, 15:42:56] Tal: https://www.10dakot.co.il/recipe/×¡×œ×˜-×—×œ×•××™/
[01/06/2021, 23:47:44] Tal: https://www.instagram.com/p/CPlPbAGlHLN/?utm_medium=copy_link
[01/06/2021, 23:47:47] Tal: ×¤× ×§×™×™×§ ×—×œ×‘×”
â€[01/06/2021, 23:47:51] Tal: â€<attached: 00000038-PHOTO-2021-06-01-23-47-51.jpg>
â€[01/06/2021, 23:48:05] Tal: â€<attached: 00000039-PHOTO-2021-06-01-23-48-05.jpg>
â€[03/06/2021, 9:16:06] Tal: â€<attached: 00000040-PHOTO-2021-06-03-09-16-06.jpg>
â€[03/06/2021, 9:16:06] Tal: â€<attached: 00000041-PHOTO-2021-06-03-09-16-06.jpg>
â€[11/07/2021, 1:40:26] Tal: â€<attached: 00000042-PHOTO-2021-07-11-01-40-26.jpg>
[13/07/2021, 23:19:00] Tal: https://bakery365.co.il/2019/03/10/%d7%9e%d7%99%d7%a1%d7%99%d7%a1%d7%99%d7%a4%d7%99-%d7%91%d7%9c%d7%95%d7%a0%d7%93-%d7%a4%d7%90%d7%99/
[25/07/2021, 18:36:08] Tal: https://www.instagram.com/reel/CRMOz3hDpM1/?utm_medium=copy_link
[25/07/2021, 18:36:10] Tal: ×§×¦×¤×ª
[29/07/2021, 23:43:53] Tal: https://bakery365.co.il/2019/03/10/%D7%9E%D7%99%D7%A1%D7%99%D7%A1%D7%99%D7%A4%D7%99-%D7%91%D7%9C%D7%95%D7%A0%D7%93-%D7%A4%D7%90%D7%99/
[02/08/2021, 10:27:11] Tal: ×¢×•×’×™×•×ª ××œ×— ×©×•×§×•×œ×“
[08/08/2021, 21:53:55] Tal: https://www.instagram.com/p/CSUaywVIoTn/?utm_medium=share_sheet
[23/08/2021, 0:24:29] Tal: https://www.alonshabo.co.il/%D7%9E%D7%90%D7%A4%D7%99-%D7%91%D7%A8%D7%99%D7%95%D7%A9/
[01/09/2021, 11:57:43] Tal: https://www.instagram.com/p/ctropmcdnjv/?utm_medium=copy_link
[01/09/2021, 11:57:49] Tal: ×¤××™ ×’×‘×™× ×” ×•×ª×¤×•×—×™×
[19/09/2021, 19:00:35] Tal: https://piebaribua.com/2017/11/30/cereal-milk-cream-puff/
[19/09/2021, 19:00:51] Tal: â€You deleted this message.
[19/09/2021, 19:00:56] Tal: https://www.oogio.net/hazelnut_and_caramel_tartelette/
[09/12/2021, 11:57:04] Tal: â€You deleted this message.
[09/12/2021, 11:57:08] Tal: https://www.hashulchan.co.il/%D7%9E%D7%AA%D7%9B%D7%95%D7%A0%D7%99%D7%9D/%D7%91%D7%99%D7%99%D7%92%D7%9C%D7%99%D7%9D-%D7%A0%D7%99%D7%95-%D7%99%D7%95%D7%A8%D7%A7%D7%99%D7%9D-%D7%90%D7%9E%D7%99%D7%AA%D7%99%D7%99%D7%9D/
[17/02/2022, 10:21:42] Tal: https://www.anatelisha.co.il/%D7%A9%D7%99%D7%A4%D7%95%D7%93%D7%99-%D7%A9%D7%A0%D7%99%D7%A6%D7%9C/
â€[23/03/2022, 13:13:03] Tal: â€<attached: 00000058-PHOTO-2022-03-23-13-13-03.jpg>
â€[23/03/2022, 13:13:03] Tal: â€<attached: 00000059-PHOTO-2022-03-23-13-13-03.jpg>
â€[23/03/2022, 13:13:03] Tal: â€<attached: 00000060-PHOTO-2022-03-23-13-13-03.jpg>
[03/04/2022, 9:54:03] Tal: https://www.cookie-fairy.com/2018/03/×¤××™-××œ×‘×™/
[01/05/2022, 14:17:59] Tal: https://www.anatelisha.co.il/%D7%92%D7%97%D7%A0%D7%95%D7%9F/
[01/05/2022, 14:18:14] Tal: ×’×³×—× ×•×Ÿ
[01/05/2022, 14:30:33] Tal: ××œ×¤×—×•×¨×¡ ×•×’×¨× ×•×œ×”
â€[12/05/2022, 23:57:05] Tal: ×¢×•×’×ª ×©×•×§×•×œ×“ ×—××”.docx â€¢ â€1 page â€<attached: 00000065-×¢×•×’×ª ×©×•×§×•×œ×“ ×—××”.docx>
[09/06/2022, 22:24:35] Tal: ××ª×›×•×Ÿ ×œ×’×¨× ×•×œ×”:

3 ×›×•×¡×•×ª ×©×™×‘×•×œ×ª ×©×•×¢×œ - ×§×•×•××§×¨
1/8 ×›×•×¡ ×©×•××©×•×
1/2 ×›×•×¡ ×©×§×“×™× (×× ×™ ××©×ª××©×ª ×‘××•×œ×‘× ×™×)
1/2 ×›×•×¡ ×§×©×™×• ×˜×‘×¢×™ 
1/2 ×›×•×¡ ××’×•×–×™ ××œ×š
1/2 ×›×¤×™×ª ×§×™× ××•×Ÿ
×§×•×¨×˜ ××œ×—
1/3 ×›×•×¡ ×©××Ÿ ×–×™×ª
1/2 ×›×•×¡ ××™×™×¤×œ ×˜×‘×¢×™

××•×¤×™× 20 ×“×§' ×¢×œ 170 ××¢×œ×•×ª
[09/06/2022, 22:24:40] Tal: ×’×¨× ×•×œ×”
[14/06/2022, 17:06:31] Tal: https://www.instagram.com/reel/CewMmTno_aw/?igshid=MDJmNzVkMjY=
[14/06/2022, 17:06:43] Tal: ×—×–×” ×¢×•×£ ×—×Ÿ ×§×•×¨×Ÿ
[22/06/2022, 19:25:58] Tal: https://www.naamagaon.com/%D7%9B%D7%9C-%D7%94%D7%9E%D7%AA%D7%9B%D7%95%D7%A0%D7%99%D7%9D/%D7%A7%D7%95%D7%A7%D7%99%D7%9C%D7%99%D7%93%D7%94-%D7%91%D7%A8%D7%90%D7%95%D7%A0%D7%99%D7%96/
[22/06/2022, 19:26:05] Tal: ×§×•×§×™×œ×™×“×”
[22/06/2022, 19:27:53] Tal: ×§×•×§×™×œ×™×“×” ×‘×¨××•× ×™×–
[22/06/2022, 19:28:02] Tal: https://www.naamagaon.com/%D7%9B%D7%9C-%D7%94%D7%9E%D7%AA%D7%9B%D7%95%D7%A0%D7%99%D7%9D/%D7%A2%D7%95%D7%92%D7%99%D7%95%D7%AA/%D7%A7%D7%95%D7%A7%D7%99%D7%9C%D7%99%D7%93%D7%94-%D7%9B%D7%93%D7%95%D7%A8%D7%99-%D7%A9%D7%95%D7%A7%D7%95%D7%9C%D7%93/
â€[03/07/2022, 13:13:03] Tal: â€<attached: 00000075-PHOTO-2022-07-03-13-13-03.jpg>
[03/07/2022, 13:13:09] Tal: ×¤×¨×œ×™× ×” ×œ×•×–
[04/07/2022, 19:57:28] Tal: https://heninthekitchen.com/blog/2019/03/27/%d7%a4%d7%a8%d7%a7-103-%d7%9e%d7%95%d7%a7%d7%a4%d7%a5/
[24/07/2022, 17:42:36] Tal: https://www.matkonzikaron.co.il/vegetarian-recipe/%D7%9B%D7%95%D7%91%D7%A0%D7%94-%D7%A9%D7%9C-%D7%A1%D7%91%D7%AA%D7%90-%D7%A9%D7%9C-%D7%A0%D7%AA%D7%9F-%D7%96%27%27%D7%9C
[24/07/2022, 17:42:37] Tal: ×§×•×‘× ×”
[10/08/2022, 14:02:45] Tal: https://www.instagram.com/reel/Cg9iXsSoF5Q/?igshid=MDJmNzVkMjY=
[10/08/2022, 14:30:34] Tal: ×©××¨×™× ×¤×¨×•×•×” ×¤×™×¡×˜×•×§ ×—×œ×‘×”
[26/08/2022, 2:10:09] Tal: https://www.instagram.com/reel/ChrFDdvIvO0/?igshid=MDJmNzVkMjY=
[27/08/2022, 22:56:15] Tal: https://www.instagram.com/reel/Chth0zODhBH/?igshid=MDJmNzVkMjY=
[27/08/2022, 22:56:32] Tal: ×˜××¨×˜×œ×˜ ×§×¨××‘×• ×©× ×¨××” ××©
[10/01/2023, 19:00:36] Tal: https://heninthekitchen.com/blog/2019/05/19/%D7%A4%D7%A8%D7%A7-117-%D7%A8%D7%A6%D7%95%D7%A2%D7%95%D7%AA-%D7%97%D7%96%D7%94-%D7%A2%D7%95%D7%A3-%D7%A2%D7%9D-%D7%A4%D7%9C%D7%A4%D7%9C%D7%99%D7%9D/
[22/04/2023, 22:22:04] Tal: https://www.anatelisha.co.il/%D7%A4%D7%99%D7%AA%D7%95%D7%AA-%D7%91%D7%9E%D7%97%D7%91%D7%AA/?fbclid=PAAaZaM8GZNUtJh1uV5Znhr7szj6j4HRI7HWmUxARui6D25J1HlSpO9VrtuzE
[30/04/2023, 21:56:48] Tal: ×¨×¢×™×•×Ÿ ××¢×•×œ×” ×œ×¨×•×¢×™
[30/04/2023, 21:57:02] Tal: .
[30/04/2023, 21:57:41] Tal: .
[18/06/2023, 0:09:04] Tal: https://matkonia.co.il/banana_pancake_veagn/
[18/06/2023, 0:10:35] Tal: https://matkonia.co.il/beetroot/
[18/06/2023, 0:13:19] Tal: https://matkonia.co.il/couscous_soup_with_quinoa/
[21/06/2023, 23:07:49] Tal: https://www.instagram.com/reel/CtwG_12gAH5/?igshid=MzRlODBiNWFlZA==
[21/06/2023, 23:07:58] Tal: ×¡×™× ×‘×•×Ÿ ×©×œ ×’×™×œ ××•×¨×Ÿ
[29/06/2023, 21:53:12] Tal: ×××© ×˜×¢×™×!! 
https://www.morinfridman.co.il/recipes/quick-banana-muffins/
[19/07/2023, 13:41:48] Tal: â€You deleted this message.
[19/07/2023, 13:41:54] Tal: https://www.instagram.com/reel/Cu4CQgWAVk-/?igshid=MzRlODBiNWFlZA==
[19/07/2023, 13:45:49] Tal: https://www.krutit.co.il/%D7%9E%D7%90%D7%A4%D7%99%D7%A0%D7%A1-%D7%AA%D7%99%D7%A8%D7%A1-%D7%A9%D7%99%D7%9C%D7%93%D7%99%D7%9D-%D7%95%D7%9E%D7%91%D7%95%D7%92%D7%A8%D7%99%D7%9D-%D7%90%D7%95%D7%94%D7%91%D7%99%D7%9D-%D7%91%D7%9E/?fbclid=IwAR1oOT5bTwUlohWdwJAU333BZ5BY-zYB2OMWocndEoYtUGrKF4Id4UAmOZc
[02/08/2023, 22:23:49] Tal: https://www.anatelisha.co.il/%d7%90%d7%a1%d7%90%d7%93%d7%95-%d7%9e%d7%a4%d7%95%d7%a8%d7%a7-%d7%91%d7%91%d7%99%d7%a8%d7%94-%d7%95%d7%a1%d7%99%d7%9c%d7%90%d7%9f/
[07/08/2023, 20:19:19] Tal: https://mobile.mako.co.il/food-recipes/recipes_column-vegetarian-recipes/Recipe-7c5c82c89e62a31006.htm
[09/08/2023, 14:03:49] Tal: ××ª×›×•×Ÿ ×œ×’×¨× ×•×œ×”:

3 ×›×•×¡×•×ª ×©×™×‘×•×œ×ª ×©×•×¢×œ - ×§×•×•××§×¨
1/8 ×›×•×¡ ×©×•××©×•×
1/2 ×›×•×¡ ×©×§×“×™× (×× ×™ ××©×ª××©×ª ×‘××•×œ×‘× ×™×)
1/2 ×›×•×¡ ×§×©×™×• ×˜×‘×¢×™
1/2 ×›×•×¡ ××’×•×–×™ ××œ×š
1/2 ×›×¤×™×ª ×§×™× ××•×Ÿ
×§×•×¨×˜ ××œ×—
1/3 ×›×•×¡ ×©××Ÿ ×–×™×ª
1/3 ×›×•×¡ ××™×™×¤×œ ×˜×‘×¢×™

××•×¤×™× 15 ×“×§' ×¢×œ 180 ××¢×œ×•×ª
[22/08/2023, 15:16:22] Tal: https://www.tavshilim.co.il/recipe/%D7%90%D7%95%D7%9B%D7%9C-%D7%A9%D7%99%D7%9C%D7%93%D7%99%D7%9D-%D7%90%D7%95%D7%94%D7%91%D7%99%D7%9D/%D7%A4%D7%A8%D7%92%D7%99%D7%95%D7%AA-%D7%91%D7%A6%D7%9C%D7%99%D7%9D-%D7%9E%D7%A7%D7%95%D7%A8%D7%9E%D7%9C%D7%99%D7%9D-%D7%95%D7%91%D7%98%D7%98%D7%94/
[11/09/2023, 14:50:26] Tal: https://lizapanelim.com/%D7%90%D7%95%D7%A8%D7%96-%D7%A2%D7%9D-%D7%A2%D7%93%D7%A9%D7%99%D7%9D-%D7%9E%D7%92%D7%93%D7%A8%D7%94/
[20/01/2024, 19:02:34] Tal: https://www.instagram.com/reel/C2UPZQotNBQ/?igsh=NmtzdnlidmlibW1s
[20/01/2024, 19:02:41] Tal: ×¤× ×§×™×™×§ ×¡×™× ×‘×•×Ÿ
[18/02/2024, 22:06:23] Tal: https://heninthekitchen.com/blog/2019/03/27/×¤×¨×§-103-××•×§×¤×¥/
[18/02/2024, 22:15:51] Tal: https://matkonia.co.il/mangold_leek_cheese/
[22/02/2024, 19:56:55] Tal: https://bromabakery.com/best-chocolate-chip-cookies/
[20/03/2024, 21:37:09] Tal: ×–×”
[20/03/2024, 21:47:22] Tal: https://bakery365.co.il/2021/08/08/×¢×•×’×™×•×ª-×—×××”-×—×•××”-××§×“××™×”-×•×©×•×§×•×œ×“-×œ×‘×Ÿ/
[02/04/2024, 19:52:40] Tal: https://food.walla.co.il/item/3548031
[03/04/2024, 13:36:10] Tal: https://www.instagram.com/reel/C5SYGV8oxQ_/?igsh=MTAzejAzd3pmc21uNw==
[03/04/2024, 13:36:21] Tal: ×¤× ×§×™×™×§ ×¨×™×§×•×˜×”
[07/04/2024, 12:24:19] Tal: https://www.facebook.com/Keshet.Broadcasting/videos/1104065650807404/?mibextid=WC7FNe
[15/04/2024, 14:32:06] Tal: https://www.oogio.net/white_chocolate_nutella_cookies/
[02/05/2024, 23:26:08] Tal: https://nikib.co.il/main-course/33026/
[24/05/2024, 14:09:38] Tal: https://www.ronyohananov.com/post/×—×™×ª×•×›×™×•×ª-×’×‘×™× ×”-×•×œ×•×˜×•×¡
[26/06/2024, 9:03:29] Tal: ×¤×•×“× ×˜ ×©×•×§×•×œ×“ × ××¡×¡×¡×¡
https://www.instagram.com/reel/CuEkhuMoDCo/?igsh=MWV0YnNleGFkZTJ2dw==
[07/07/2024, 20:05:06] Tal: https://www.lichtenstadt.com/2013/01/blog-pos-12/
×”×›×™ ××”×™×¨, ×× ×™ ×œ× ××©×¨×” ××ª ×”×¢×“×©×™×, ×¨×§ ×©×•×˜×¤×ª, ×•××©×ª××©×ª ×‘×¢×’×‘× ×™×•×ª ××¨×•×¡×§×•×ª ××§×•×¤×¡×
[03/08/2024, 23:50:20] Tal: https://www.foodsdictionary.co.il/Recipes/5048
[12/08/2024, 13:34:23] Tal: https://www.lichtenstadt.com/2024/06/×¤×¡×˜×”-×‘×¨×•×˜×‘-×¢×’×‘× ×™×•×ª-×•×¤×˜×”-×˜×¨× ×“-×”×¤×˜×”-×—×•×–×¨/
[13/08/2024, 23:59:53] Tal: https://www.instagram.com/reel/C1APeEcIzJ2/?igsh=bjA1M2lud2RnMGho

×¢×•×’×ª ×©××¨×™× ×¤×¨×•×•×” ×—×Ÿ ×§×•×¨×Ÿ
[14/08/2024, 0:03:30] Tal: https://www.instagram.com/reel/CuEkhuMoDCo/?igsh=MWV0YnNleGFkZTJ2dw==

×¤×•×“× ×˜ ×©×•×§×•×œ×“ ×©× ×¨××” ×¤×’×– ×©×œ ××‘×™×”
[23/08/2024, 12:07:30] Tal: https://www.instagram.com/reel/CojgABOolh9/?igsh=MW02aGhlNmMxOTFieA==
[29/08/2024, 16:38:20] Tal: https://heninthekitchen.com/blog/2022/02/02/××•×¨×–-×¢×-×¢×•×£-××¤×•× ×”-×•×’×–×¨-×‘×¡×™×¨-××—×“/
[08/09/2024, 18:02:51] Tal: https://www.facebook.com/share/r/Z9VVYnpMRZLSM8jH/?mibextid=UalRPS
[09/09/2024, 9:43:25] Tal: https://www.foodisgood.co.il/recipe/××ª×›×•×Ÿ-×œ×—×××ª-×‘×•×˜× ×™×/
[11/09/2024, 20:53:29] Tal: ×©× ×™×¦×œ ×˜×¢×™×
â€[13/09/2024, 14:01:01] Tal: â€<attached: 00000129-PHOTO-2024-09-13-14-01-01.jpg>
[19/09/2024, 12:47:03] Tal: ×–×” ×¤×’×–
[26/09/2024, 16:29:32] Tal: https://creama.co.il/blogs/news/%d7%99%d7%95%d7%9d-%d7%a2%d7%95%d7%92%d7%99%d7%95%d7%aa-%d7%94%d7%9e%d7%96%d7%9c-%d7%9e%d7%aa%d7%9b%d7%95%d7%9f-%d7%9c%d7%a2%d7%95%d7%92%d7%99%d7%95%d7%aa-%d7%91%d7%94%d7%a9%d7%a8%d7%90%d7%aa-%d7%a2%d7%95%d7%92%d7%99%d7%95%d7%aa-%d7%94%d7%90%d7%95%d7%a1%d7%91%d7%a8%d7%a0%d7%93%d7%98-%d7%94%d7%9e%d7%9e%d7%9b%d7%a8%d7%95%d7%aa
[26/09/2024, 16:29:33] Tal: https://www.facebook.com/share/r/wH8udionWA12kb41/?mibextid=UalRPS
[27/09/2024, 13:56:17] Tal: https://www.oogio.net/5-ingredients-brownies/
[30/09/2024, 11:17:59] Tal: ×–×”
â€[09/10/2024, 9:55:50] Tal: â€<attached: 00000135-PHOTO-2024-10-09-09-55-50.jpg>
[09/10/2024, 23:13:19] Tal: × ×©××¢ ××•×©
[27/10/2024, 14:43:56] Tal: ×¤×¨×’×™×•×ª ×•×¤×˜×¨×™×•×ª, ××•×¨×–, ×¢×•×’×ª ×’×‘×™× ×” ×‘×™×¡×§×•×•×™×˜×™×
[27/10/2024, 14:43:57] Tal: ×¤×¨×’×™×•×ª
[27/10/2024, 14:43:59] Tal: ×¤×˜×¨×™×•×ª
[27/10/2024, 14:44:01] Tal: ×‘×¦×œ ×œ×‘×Ÿ
[27/10/2024, 14:46:11] Tal: 2 ×©×× ×ª
[27/10/2024, 14:46:22] Tal: 2 ××™× ×¡×˜× ×˜
[27/10/2024, 14:46:24] Tal: 2 ×’×‘×™× ×”
[27/10/2024, 14:46:27] Tal: 2 ×‘×™×¡×§×•×•×™×˜×™×
[27/10/2024, 14:46:29] Tal: ×¤×™×¨×•×ª ×•×™×¨×§×•×ª
[07/11/2024, 21:07:10] Tal: https://www.cookie-fairy.com/2020/02/×‘×¨××•× ×™×–-×§×¨×-×‘×¨×•×œ×”/

××™×š ×¢×•×©×™× ××ª ×–×” ×‘×¤×¨×•×•×”
[07/11/2024, 21:08:54] Tal: ×œ×‘×¨×•×œ×”:
×§×•×¨× ×¤×œ×•×¨
×‘×™×¦×™×
×©×× ×ª ×¦××—×™×ª
[15/11/2024, 13:13:27] Tal: ×¡×•×¤×œ×”
×—×œ×•×ª
â€[21/11/2024, 22:58:11] Tal: ××¦×‘×¢×•×ª ×‘× × ×” ×•×§×§××• ×œ×™×œ×“×™× â€<attached: 00000149-PHOTO-2024-11-21-22-58-11.jpg>
[24/11/2024, 12:11:40] Tal: ×ª×™×¨×¡
[27/11/2024, 12:53:33] Tal: ×œ× ×™×•×“×¢×ª ×× *×”×›×™* ×˜×¢×™× ××‘×œ ×‘×”×—×œ×˜ ×××Ÿ×“ ×˜×¢×—× ×•×§×œ!
3 ×’×–×¨×™× ×œ×—×ª×•×š ×œ×¢×™×’×•×œ×™×
3 ×‘×˜×˜×•×ª (×œ× ×”×¢× ×§×™×•×ª) ×œ×—×ª×•×š ×œ×§×•×‘×™×•×ª
×—×•×¤×Ÿ ×§×©×™×•

×œ×›×¡×•×ª ×”×›×œ ×‘××™× ×¨×•×ª×—×™×, ×œ×‘×©×œ ×¢×“ ×©××ª×¨×›×š.
×œ×˜×—×•×Ÿ
××œ×—, ×¤×œ×¤×œ ×•×§×¦×ª ××’×•×– ××•×¡×§×˜
[27/11/2024, 12:53:33] Tal: ×ª×›×œ×¡
×§×¦×ª ×©××Ÿ ×–×™×ª 
×‘×¦×œ, ×”×¨×‘×” ×××“ ×’×³×™× ×’×³×¨ (×›××œ×• ×›××” ×¡× ×˜×™××˜×¨×™× ×˜×•×‘×™×) 
×§×•×‘×™×•×ª ×’×¡×•×ª ×©×œ ×›×œ ×™×¨×§ ×›×ª×•× ×©××ª ××•×”×‘×ª. ×œ××—×¨×•× ×” ×× ×—× ×• ×‘×§×˜×¢ ×©×œ ×”××•×Ÿ×Ÿ×Ÿ×Ÿ×Ÿ ×’×–×¨ ×•××– ×¢×•×“ ×›×œ ××™× ×™ (×“×œ×¢×ª, ×“×œ×•×¨×™×ª, ×‘×˜×˜×”, ××” ×©×™×©)
×œ×˜×’×Ÿ ××ª ×”×›×œ ×œ×›××” ×“×§×•×ª ×¢× ××œ×—

×œ×›×¡×•×ª ×‘××™×, ×œ×”×¨×ª×™×— ×•×œ×ª×ª ×œ×‘×©×œ ×¢×“ ×©×”×›×œ ×××© ×¨×š. ××ª×™×©×”×• ×¤×” ×œ×”×•×¡×™×£ ×¤×œ×¤×œ ×©×—×•×¨ ×œ×¤×™ ×”×˜×¢×. 

×œ×˜×—×•×Ÿ ×¢× ×‘×œ× ×“×¨ ××•×˜ ×¢×“ ×©×××© ×××© smooth.

×œ×”×•×¡×™×£ ×§×¨× ×§×•×§×•×¡ ×•×œ×ª×ª ×¢×•×“ ×›××” ×“×§×•×ª ×‘×™×©×•×œ.
[27/11/2024, 12:53:33] Tal: ×œ× ×××© ××ª×›×•×Ÿ, ×¨×§ ×”×¦×¢×”: 
×× ×™ ××›× ×™×¡×” ×œ××¨×§, ×™×—×“ ×¢× ×“×œ×¢×ª ×“×œ×•×¨×™×ª ×’×–×¨, ×’× ×™×¨×§×•×ª ×œ×‘× ×™× ×•×‘×”×™×¨×™× ××›×œ ×¡×•×’ - ×§×™×©×•× ×‘×”×™×¨, ×©×•××¨, ×§×•×œ×•×¨×‘×™, ×›×¨×™×©×”, ×©×•×¨×© ×¡×œ×¨×™ ×•×©×•×¨×© ×¤×˜×¨×•×–×™×œ×™×”. ×›×©×–×” × ×˜×—×Ÿ ×–×” ×™×•×¦× ×›×ª×•×, ×•×›×š ×–×” ×’× ×¢×•×‘×¨ ××ª ××‘×—×Ÿ ×”×™×œ×“×™× ×©×œ×™ ×•×’× ×× ×™ ×™×•×“×¢×ª ×©×”× ××•×›×œ×™× ×™×¨×§×•×ª ××’×•×•× ×™×.
[27/11/2024, 12:53:40] Tal: ××ª×›×•× ×™× ×œ ××¨×§ ×›×ª×•×
[18/12/2024, 10:58:25] Tal: ×¢×•×£ ×¢× ××•×¨×– ×•×§×™× ×•××” 
https://www.facebook.com/share/r/1Bj1UdWHXq/?mibextid=UalRPS
[18/12/2024, 11:00:46] Tal: https://www.facebook.com/share/r/1DxHdKua2D/?mibextid=UalRPS

×¡×œ××•×Ÿ ×—×¨×“×œ ×“×™×–×³×•×Ÿ ×•×“×‘×©
[24/01/2025, 0:17:49] Tal: https://www.ronyohananov.com/post/××¨×§-×©×¢×•×¢×™×ª-×¡××™×š
[23/02/2025, 13:54:55] Tal: https://www.instagram.com/reel/DEDQbQooY_D/?igsh=OXJsZHQ1eTVvZjh0

×¤×¨×’×™×ª ×¢× ×¢×¨××•× ×™× ×•×¤×˜×¨×™×•×ª ×•×§×¨× ×§×•×§×•×¡
[23/02/2025, 15:09:15] Tal: https://heninthekitchen.com/blog/2024/12/04/×¡×œ×˜-×¡×ª×•×•×™-×¢×-×‘×˜×˜×”-×—×œ×•××™-×•×‘×•×¨×’×•×œ/
[25/02/2025, 15:49:03] Tal: https://www.oogio.net/nutella-rouglach/
[27/03/2025, 20:52:44] Tal: https://www.shescooking.net/post/%D7%A2%D7%95%D7%92%D7%99%D7%95%D7%AA-%D7%A9%D7%95%D7%A7%D7%95%D7%9C%D7%93-%D7%A4%D7%90%D7%93%D7%92-%D7%99%D7%95%D7%AA-%D7%A2%D7%9D-%D7%9E%D7%9C%D7%97
â€[27/03/2025, 20:52:44] Tal: ×”×›× ×”: ×œ×¨×›×š ××ª ×”×—×××” ×•×œ×¢×¨×‘×‘ ××ª ×›×œ ×”××¨×›×™×‘×™× ×™×—×“. ×œ×ª×ª ×œ×¢×™×¡×” ×œ×”×™×•×ª ×‘××§×¨×¨ ×¢×“ ×—×¦×™ ×©×¢×” ×•××– ×œ×™×¦×•×¨ ×›×“×•×¨×™× ×•×œ×”× ×™×— ×‘×ª×‘× ×™×ª ×¢× × ×™×™×¨ ××¤×™×™×”. ×œ×©×˜×— ××¢×˜ ××ª ×”×›×“×•×¨×™× ×¢× ××–×œ×’ ×•×œ××¤×•×ª ×›13 ×“×§×•×ª ×‘×ª× ×•×¨ ×©×—×•×× ××¨××© ×‘175-180 ××¢×œ×•×ª. ×›×©×”×¢×•×’×™×•×ª ××§×‘×œ×•×ª ×¦×‘×¢ ××•×›×Ÿ ××•×¦×™××™× ××”×ª× ×•×¨ ×•× ×•×ª× ×™× ×œ×”×ª×§×¨×¨. ×—×©×•×‘ ×œ× ×œ×’×¢×ª ×¢×“ ×”×ª×§×¨×¨×•×ª ××•×—×œ×˜×ª, ×›×“×™ ×©×œ× ×™×ª×¤×•×¨×¨×•. ×œ×”×•×¦×™× ×‘×–×”×™×¨×•×ª ×•×œ×”×—×–×™×§ ×‘×§×•×¤×¡×” ××˜×•××” ×‘××§×¨×¨. â€<attached: 00000162-PHOTO-2025-03-27-20-52-44.jpg>
[22/04/2025, 11:36:44] Tal:
â€[22/04/2025, 11:36:44] Tal: â€<attached: 00000164-PHOTO-2025-04-22-11-36-44.jpg>
â€[22/04/2025, 11:36:44] Tal: â€<attached: 00000165-PHOTO-2025-04-22-11-36-44.jpg>
â€[22/04/2025, 11:36:45] Tal: â€<attached: 00000166-PHOTO-2025-04-22-11-36-45.jpg>
[02/05/2025, 16:22:29] Tal: https://www.lichtenstadt.com/2023/06/%D7%91%D7%A8%D7%90%D7%95%D7%A0%D7%99%D7%96-%D7%A8%D7%9B%D7%99%D7%9D-%D7%95%D7%A0%D7%99%D7%9E%D7%95%D7%97%D7%99%D7%9D-%D7%9C%D7%9C%D7%90-%D7%92%D7%9C%D7%95%D7%98%D7%9F/
[11/05/2025, 20:36:35] Tal: https://www.instagram.com/reel/DJYrCNosO27/?igsh=MW5idmZ0cWFuZTkxYw==
[11/05/2025, 20:39:00] Tal: https://www.instagram.com/reel/DJbgk0ntLpy/?igsh=MTRkeGxocjNocmZpMg==
[11/05/2025, 22:38:49] Tal: ×§×¦×™×¦×•×ª
×¡×œ××•×Ÿ
×¤×ª×™×ª×™×
[11/05/2025, 22:39:00] Tal: https://www.instagram.com/reel/DG0jGU0oA2p/?igsh=ZDE4bzB5d3Y3NTlu

×× ×™ ××¨×™×™×¨×ª
[11/05/2025, 22:39:26] Tal: ×©×¢×•×¢×™×ª ×™×¨×•×§×”
[19/05/2025, 23:17:56] Tal: https://matkonia.co.il/lentils_quinoa_pat-2/
â€[21/05/2025, 21:36:12] Tal: ×‘×¦×§ ×¤×™×¦×” â€<attached: 00000174-PHOTO-2025-05-21-21-36-12.jpg>
[21/05/2025, 21:39:06] Tal: https://www.lichtenstadt.com/2025/05/%d7%a4%d7%95%d7%a7%d7%99-%d7%91%d7%95%d7%9c-%d7%a2%d7%9d-%d7%a1%d7%9c%d7%9e%d7%95%d7%9f-%d7%95%d7%90%d7%95%d7%a8%d7%96-%d7%94%d7%90%d7%a8%d7%95%d7%97%d7%94-%d7%94%d7%9e%d7%95%d7%a9%d7%9c%d7%9e%d7%aa/
[21/05/2025, 21:40:31] Tal: https://www.lichtenstadt.com/2024/12/%d7%a2%d7%95%d7%a3-%d7%a2%d7%9d-%d7%90%d7%95%d7%a8%d7%96-%d7%91%d7%aa%d7%91%d7%a0%d7%99%d7%aa-%d7%a2%d7%9d-%d7%90%d7%a4%d7%95%d7%a0%d7%94-%d7%95%d7%aa%d7%99%d7%a8%d7%a1-%d7%9e%d7%a0%d7%94-%d7%9e/
[21/05/2025, 21:42:12] Tal: https://www.lichtenstadt.com/2024/01/%d7%9e%d7%a7-%d7%90%d7%a0%d7%93-%d7%a6%d7%b3%d7%99%d7%96-%d7%91%d7%a8%d7%95%d7%a7%d7%95%d7%9c%d7%99-%d7%98%d7%a2%d7%99%d7%9d-%d7%91%d7%98%d7%99%d7%a8%d7%95%d7%a3/
[22/05/2025, 20:26:07] Tal: https://www.instagram.com/reel/DJYrCNosO27/?igsh=MW5idmZ0cWFuZTkxYw==
[22/05/2025, 20:47:34] Tal: https://heninthekitchen.com/blog/2024/04/10/××¡××“×•-×¢×-×™×¨×§×•×ª-×¦×œ×•×™-×‘×ª× ×•×¨/
[22/05/2025, 20:59:46] Tal: https://heninthekitchen.com/blog/2024/02/14/×§×¦×™×¦×•×ª-×‘×˜×˜×”-×•×—×–×”-×¢×•×£/
[28/06/2025, 23:03:35] Tal: ××œ×•×”×™×•×ª
[09/07/2025, 11:14:23] Tal: https://matkonia.co.il/quinoa_batata/
[09/07/2025, 11:16:22] Tal: https://matkonia.co.il/oatmeal_banana_muffins/
[09/07/2025, 11:28:21] Tal: .
[09/07/2025, 11:29:43] Tal: https://matkonia.co.il/lentils_quinoa_pat-2/
[23/07/2025, 12:32:27] Tal: .
[23/07/2025, 12:32:35] Tal: .
[07/08/2025, 0:01:36] Tal: ×××¤×™× ×¡ ×‘×¨×•×§×•×œ×™
[07/08/2025, 0:01:37] Tal: ×¡×œ×§
[07/08/2025, 0:01:59] Tal: ×¡×œ×˜ ×‘×™×¦×™×
[07/08/2025, 0:07:16] Tal: https://matkonia.co.il/beetroot/
[07/08/2025, 0:09:16] Tal: .
[07/08/2025, 0:10:56] Tal: ×‘×‘×•×§×¨ 
×œ×™×” - ×¤×¨×™ ×¤× ×§×™×™×§ ×•×’×‘×™× ×”
×¨×•×¢×™ - ×™×•×’×•×¨×˜ ×•×’×¨× ×•×œ×”
×œ×—× ×¢× ×—×‘×™×ª×”

×‘×¦×”×¨×™×™×
×¨×•×¢×™ - ×¤×¨×’×™×ª ××•×¨×– ×‘×¨×•×§×•×œ×™
×œ×™×” - ×¢×•×£ ×•××•×¨×– ×•×¡×œ×§

× ×©× ×•×© - ×××¤×™× ×¡ ×›×œ×©×”×• ×•×™×¨×§×•×ª/×¤×™×¨×•×ª

×¢×¨×‘ -
×¨×•×¢×™ - ×¡×œ××•×Ÿ ×•×¤×¡×˜×”
[07/08/2025, 0:11:16] Tal: ×¡×œ×§
×¡×œ××•×Ÿ
×¤×¡×˜×”
×××¤×™× ×¡

×¢×•×’×”
×¢×•×’×™×•×ª
[18/08/2025, 0:22:21] Tal: https://www.morinfridman.co.il/recipes/red-lentil-cracker/
[18/08/2025, 0:27:10] Tal: https://www.morinfridman.co.il/recipes/apple-muffins-2/
[18/08/2025, 0:27:18] Tal: ×§×•×¡×§×•×¡
[21/08/2025, 20:28:49] Tal: https://www.instagram.com/reel/DNgIri0sufO/?igsh=MXdzazFoYWpyeDNuNg==
[12/09/2025, 10:08:36] Tal: ××˜×’× ×ª ×‘×¦×œ
××•×¡×™×¤×” ×¨×¡×§ 200 ×’×¨×
××•×¡×™×¤×” ××™× ×©×™×›×¡×” ××‘×œ ×™×™×©××¨ ×¡××™×š 
××•×¡×™×¤×” ××œ×— ×¤×œ×¤×œ ×¤×¤×¨×™×§×” ××ª×•×§×” ×•×§×¦×ª ×—×¨×™×¤×” ×©×•× ×§×¦×ª ×—×•×•×™××’

×œ×§×¦×™×¦×•×ª ×©××™× 1 ×§×´×’ ×”×•×“×• ×¨×‘×¢ ×›×•×¡ ×¤×™×¨×•×¨×™×ª ×•×‘×™×¦×” ×•×—×¦×™ ×›×¤×™×ª ××‘×§×ª ×¡×•×“×” ×œ×©×ª×™×” ×•×ª×‘×œ×™× ×™× ××œ×— ×¤×œ×¤×œ ××‘×§×ª ××¨×§ ×‘×¦×œ ×©×•× ×¤×¤×¨×™×§×”

×¢×•×©×” ×¢× ×™×“×™×™× ×¨×˜×•×‘×•×ª ×›×“×•×¨×™×
×©××” ×‘×¨×•×˜×‘ ×©××ª×‘×©×œ
×—×¦×™ ×©×¢×” ×‘×¡×™×¨ 

×™××œ×œ×” ×‘×™×™â¤ï¸
[13/09/2025, 20:15:38] Tal: .
[18/09/2025, 12:12:08] Tal: https://www.10dakot.co.il/recipe/×—×˜×™×¤×™-×¢×•×£/
[18/09/2025, 12:12:22] Tal: â€You deleted this message.
[18/09/2025, 12:13:23] Tal: https://matkonia.co.il/×¢×•×’×ª-×‘× × ×•×ª-×•×¡×™×œ××Ÿ/
[18/09/2025, 12:13:56] Tal: ×›×¨×•×‘×™×ª ×©×œ ××™×™×œ ×©× ×™
[18/09/2025, 12:15:40] Tal: https://matkonia.co.il/mangold_leek_cheese/
[18/09/2025, 22:18:55] Tal: https://www.instagram.com/reel/DMAi3c8oNgV/?igsh=MThpaXM4emx5dWZvbQ==
[18/09/2025, 22:22:16] Tal: https://www.instagram.com/reel/DG0jGU0oA2p/?igsh=ZDE4bzB5d3Y3NTlu
[18/09/2025, 22:30:53] Tal: https://www.instagram.com/reel/DGQyg7GIMxi/?igsh=MWZnNTF3Y2Y3aDF6YQ==
[29/09/2025, 21:12:25] Tal: ×‘×•×œ×•× ×–
[29/09/2025, 21:14:25] Tal: https://www.instagram.com/reel/Csgaw6jgjvV/?igsh=MWI4OW5rc2I2cTd1Mw==
[29/09/2025, 21:17:18] Tal: https://lizapanelim.com/×¡×™×¨-×§×¦×™×¦×•×ª-×¢×-×¤×ª×™×ª×™×-×•××¤×•× ×”/
[15/10/2025, 23:35:04] Tal: https://www.lichtenstadt.com/2025/08/×§×¦×™×¦×•×ª-×¢×•×£-×¢×-××¤×•× ×”-×©×›×•×œ×-××•×”×‘×™×/
[21/10/2025, 20:27:51] Tal: ×¤× ×§×™×™×§ ×‘× × ×”
[21/10/2025, 20:28:00] Tal: ×¤×¡×˜×” ×‘×¨×•×˜×‘ ×¢×’×‘× ×™×•×ª
[30/10/2025, 7:29:05] Tal: https://www.morinfridman.co.il/recipes/date-and-cashew-balls/
[08/11/2025, 20:51:10] Tal: https://www.lizapanelim.com/×¢×•×£-×‘×ª× ×•×¨-×¢×-×ª×¤×•×—×™-××“××”-×¡×œ×§-×•×’×–×¨/
[08/11/2025, 20:54:10] Tal: ××¨×§ ×›×¨×™×©×” â€<This message was edited>
[08/11/2025, 21:05:15] Tal: https://www.instagram.com/reel/DQwWa2NDKhT/?igsh=bHFnc3JyaWd1N2Rq
[08/11/2025, 21:28:52] Tal: ×¤×™×¦×”
[08/11/2025, 21:35:40] Tal: https://www.morinfridman.co.il/recipes/farmer-cheese-dough-pizza/
[08/11/2025, 21:37:27] Tal: https://tzutzikim.co.il/×××¤×™× ×¡-×’×–×¨-×•×˜×—×™× ×”-×œ×œ×-××•×¦×¨×™-×—×œ×‘/
[08/11/2025, 21:55:44] Tal: ×××¤×™× ×¡ ×–×™×ª×™×
[08/11/2025, 21:59:25] Tal: ×××¤×™× ×¡ ×ª×™×¨×¡
[13/11/2025, 12:03:05] Tal: https://www.morinfridman.co.il/recipes/rich-banana-pancake/
[13/11/2025, 12:18:12] Tal: https://www.lizapanelim.com/×¤×¡×˜×”-×™×œ×“×™×/
[25/11/2025, 20:20:10] Tal: https://matkonia.co.il/×××¤×™× ×¡-×§× ××•×Ÿ-×¨××©-×”×©× ×”-×’×-×œ×ª×™× ×•×§×•×ª-2/
[25/11/2025, 20:21:35] Tal: https://matkonia.co.il/cheese_buns/
[25/11/2025, 20:22:36] Tal: https://matkonia.co.il/cheese_olive_muffin/
[25/11/2025, 22:05:39] Tal: https://www.instagram.com/reel/DRZja9CDbpP/?igsh=MWttaThyd3M0NnA3Zg==
[27/11/2025, 8:05:28] Tal: https://www.instagram.com/reel/DRe5XvqDYKX/?igsh=MXhvMHp1czFxdHZnbQ==
[27/11/2025, 22:03:08] Tal: https://www.instagram.com/reel/DReG3VriJPS/?igsh=NTJmeGtvYXNicWVm
[10/12/2025, 7:40:14] Tal: ×œ×—×× ×™×•×ª
[10/12/2025, 7:40:18] Tal: ××¨×§ ×¦×— â€<This message was edited>
[10/12/2025, 7:40:29] Tal: ×¤×¨×’×™×•×ª
â€[21/12/2025, 22:44:18] Tal: ××ª×›×•×Ÿ ×§×¦×¤×ª â€<attached: 00000235-PHOTO-2025-12-21-22-44-18.jpg>
